{
  "schema_version": 1,
  "id": "worktree-fanin-before-complete",
  "skill": "orchestrator",
  "description": "A verified worktree lane is merged into the epic branch before its task is marked complete.",
  "tags": ["worktree", "fanin", "mutation-safety"],
  "tiers": ["contract"],
  "contract_assertions": [
    {
      "id": "skill-fanin-order",
      "description": "The skill declares fan-in before terminal completion.",
      "mode": "all",
      "paths": ["skills/src/pl-orchestrator.md"],
      "pattern": "Fan-in before terminal completion"
    },
    {
      "id": "agent-worktree-order",
      "description": "The direct agent declares the worktree completion invariant.",
      "mode": "all",
      "paths": ["agents/orchestrator.md"],
      "pattern": "Worktree completion invariant"
    }
  ],
  "expected": {}
}
