{
  "schema_version": 1,
  "id": "ambiguous-tier-requires-operator-answer",
  "skill": "orchestrator",
  "description": "An ambiguous work-type classification remains unresolved until the operator assigns its tier.",
  "tags": ["gate", "model-routing", "ambiguity"],
  "tiers": ["contract"],
  "contract_assertions": [
    {
      "id": "tier-question-stops-dispatch",
      "description": "Both orchestrator surfaces require an explicit answer for a tier-question row.",
      "mode": "all",
      "paths": ["skills/src/pl-orchestrator.md", "agents/planar-orchestrator.md"],
      "pattern": "`tier: \\?`"
    },
    {
      "id": "no-round-up",
      "description": "No surface's ambiguity handling ever outputs an auto-escalation to large (US-10: grade the absence of the silent-escalation behavior, not the sentence that disclaims it).",
      "mode": "none",
      "paths": ["skills/src/pl-orchestrator.md", "agents/planar-orchestrator.md", "agents/models.md"],
      "pattern": "default to `large`"
    }
  ],
  "expected": {}
}
