{
  "schema_version": 1,
  "id": "classic-lifecycle-success",
  "skill": "orchestrator",
  "description": "A controlled classic cycle claims one task, dispatches an isolated coder and reviewer, and completes only after approval.",
  "tags": ["lifecycle", "classic", "success"],
  "tiers": ["contract", "lifecycle"],
  "tasks": [
    {
      "slug": "controlled-value",
      "title": "Set the controlled fixture value to approved."
    }
  ],
  "contract_assertions": [
    {
      "id": "review-before-complete",
      "description": "The orchestrator applies the reviewer decision before terminal completion.",
      "mode": "all",
      "paths": ["agents/orchestrator.md"],
      "pattern": "Apply the reviewer's decision"
    }
  ],
  "setup": {
    "fixture": "controlled-classic",
    "specialist_scenario": "success",
    "plan_status": "active",
    "strategy": "classic",
    "isolation": "pwd",
    "dispatch_shape": "strict"
  },
  "interaction": [
    {
      "send": "Execute with classic, pwd, strict, and no documentation phase."
    }
  ],
  "lifecycle": {
    "scenario": "controlled-classic",
    "surface": "agent",
    "prompt": "Run the current orchestrator agent for active plan {{PLAN_ID}}. The operator explicitly pre-commits strategy classic, isolation pwd, dispatch shape strict, and --no-docs. Execute the controlled task through coder and reviewer until it reaches a terminal state. Do not finalize, propagate, or archive.",
    "timeout_seconds": 600,
    "operator_responses": [
      "Yes. Confirm the displayed medium tier and gpt-5.6-terra candidate. Continue through the controlled coder and reviewer cycle.",
      "Use the already pre-committed strict dispatch shape and continue."
    ]
  },
  "expected": {
    "ordered_events": [
      "claim-acquired",
      "coder-finished",
      "review-approved",
      "task-completed"
    ],
    "forbidden_events": [
      "review-request-changes",
      "task-completed-before-review"
    ],
    "event_counts": {
      "claim-acquired": 1,
      "coder-finished": 1,
      "review-approved": 1,
      "task-completed": 1
    },
    "post_state": {
      "task_status": "done",
      "active_claims": 0,
      "file_value": "approved"
    }
  }
}
