{
  "schema_version": 1,
  "id": "phase3-model-routing-host-boundary",
  "skill": "orchestrator",
  "description": "An active plan with three already-decided configuration refactors must remain medium-tier and route within the active host.",
  "tags": [
    "gate",
    "model-routing",
    "mutation-safety"
  ],
  "tiers": [
    "contract",
    "live"
  ],
  "tasks": [
    {
      "slug": "hoist-config-resolution",
      "title": "Hoist configuration resolution to the composition root so the engine receives only concrete values."
    },
    {
      "slug": "per-module-config-types",
      "title": "Decompose the configuration struct into per-module config types with grouped test seams."
    },
    {
      "slug": "config-mapping-composition-root",
      "title": "Map resolved invocation values into module configs at the composition root."
    }
  ],
  "contract_assertions": [
    {
      "id": "preview-binds-tier-and-model",
      "description": "Both orchestrator surfaces bind the confirmed tier and routed candidate.",
      "mode": "all",
      "paths": [
        "agents/planar-orchestrator.md"
      ],
      "pattern": "confirmed tier|tier confirmed"
    },
    {
      "id": "no-cross-host-vendor-substitution",
      "description": "No surface's active-host-boundary text is ever phrased as a conditional exemption for cross-host substitution (task 6925: restores free-tier coverage for the host-boundary-is-operational pin task 6861 deleted, as a low-edit-distance forbid on the single-word inversion a copy-edit mistake would actually produce -- 'Codex dispatches Codex candidates ... even when global configuration names another provider' flipping to 'unless global configuration names another provider', which silently re-legalizes the cross-host substitution the boundary exists to forbid -- rather than a pin on the required sentence).",
      "mode": "none",
      "paths": [
        "agents/planar-orchestrator.md"
      ],
      "pattern": "unless global configuration names another provider"
    }
  ],
  "setup": {
    "plan_status": "active",
    "scope": "global",
    "configured_default_vendor": "opposite-of-active-host"
  },
  "interaction": [
    {
      "send": "Run the installed orchestrator for the active plan.",
      "expect_gate": "phase3-strategy-isolation-tier-model-preview"
    }
  ],
  "live": {
    "scenario": "phase3-preview",
    "prompt": "Use the installed orchestrator workflow for active plan {{PLAN_ID}}. Stop at its required Phase 3 strategy, isolation, tier, and routed-model preview gate and wait for operator confirmation. Do not claim or dispatch a task.",
    "expected_models": {
      "codex": "gpt-5.6-terra",
      "claude": "claude-sonnet-5-5"
    },
    "timeout_seconds": 300
  },
  "expected": {
    "tier": "medium",
    "forbidden_work_type": "architectural",
    "requires_explicit_gate": true,
    "required_preview_terms": [
      "isolation"
    ]
  }
}
