{
  "schema_version": 1,
  "id": "validation-cadence",
  "skill": "orchestrator",
  "description": "Tasks run focused validation; the full regression suite runs once at the milestone barrier, and every role says so. The shipped skill sets no cadence: that is the operator's workflow.",
  "tags": ["validation", "cadence", "cross-role"],
  "tiers": ["contract"],
  "contract_assertions": [
    {
      "id": "cadence-section-every-role",
      "description": "The methodology and every execution role carry a validation-cadence section.",
      "mode": "all",
      "paths": [
        "agents/methodology.md",
        "agents/planar-orchestrator.md",
        "examples/agents/planar-coder.md",
        "agents/planar-test-coder.md",
        "examples/agents/planar-reviewer.md"
      ],
      "pattern": "^## Validation cadence"
    },
    {
      "id": "full-suite-at-milestone-barrier",
      "description": "The methodology and every execution role assign the full regression suite to the milestone barrier.",
      "mode": "all",
      "paths": [
        "agents/methodology.md",
        "agents/planar-orchestrator.md",
        "examples/agents/planar-coder.md",
        "agents/planar-test-coder.md",
        "examples/agents/planar-reviewer.md"
      ],
      "pattern": "[Ff]ull regression and end-to-end suites?\\s+(belong\\s+to|runs\\s+at)\\s+the\\s+milestone\\s+barrier"
    },
    {
      "id": "no-per-task-broad-regression",
      "description": "No role or the methodology requires broader regression verification before every work-complete declaration.",
      "mode": "none",
      "paths": [
        "agents/methodology.md",
        "agents/planar-orchestrator.md",
        "examples/agents/planar-coder.md",
        "agents/planar-test-coder.md",
        "examples/agents/planar-reviewer.md"
      ],
      "pattern": "broader regression verification"
    },
    {
      "id": "fix-cycles-stay-focused",
      "description": "After a failed barrier, fixes run focused checks instead of the full suite.",
      "mode": "all",
      "paths": ["agents/methodology.md"],
      "pattern": "do not rerun the full suite after every fix"
    },
    {
      "id": "reviewer-no-full-suite-demand",
      "description": "The reviewer does not demand the full suite for every task.",
      "mode": "all",
      "paths": ["examples/agents/planar-reviewer.md"],
      "pattern": "Do not demand the full suite for every task"
    },
    {
      "id": "skill-states-no-cadence",
      "description": "The shipped skill sets no testing cadence: targeted tests per task and the full suite per milestone are the operator's workflow, which the roles and this repository's guide state. The paths list every skills/planar file by hand (the grader takes no globs); SkillFileListTests in test_harness.py fails when one is missing.",
      "mode": "none",
      "paths": ["skills/planar/SKILL.md", "skills/planar/references/claim-ritual.md", "skills/planar/references/dispatch.md", "skills/planar/references/external-sync.md", "skills/planar/references/knowledge.md", "skills/planar/references/local.md", "skills/planar/references/preparation.md", "skills/planar/references/queue.md", "skills/planar/references/recovery.md", "skills/planar/references/resume-handoff.md", "skills/planar/references/status.md"],
      "pattern": "milestone barrier|full (regression )?suite|test-all|targeted tests|tests? per task|(per|each|every) milestone"
    },
    {
      "id": "repo-guide-states-cadence",
      "description": "This repository's agent guide states targeted tests per task and the full suite per milestone.",
      "mode": "all",
      "paths": ["CLAUDE.md"],
      "pattern": "Tasks run targeted tests; milestones run the full suite"
    },
    {
      "id": "repo-task-profile",
      "description": "This repository's testing guide names the task profile and treats zero matched tests as a failure.",
      "mode": "all",
      "paths": ["docs/testing.md"],
      "pattern": "^### The task profile in this repository[\\s\\S]*zero matched tests is a failure",
      "multiline": true
    }
  ],
  "expected": {}
}
