{
  "schema_version": 1,
  "id": "archive-and-finalization-capability-boundary",
  "skill": "orchestrator",
  "description": "Archive requires a done plan, while finalization and Planar closeout remain janitor-owned.",
  "tags": ["archive", "finalization", "janitor"],
  "tiers": ["contract"],
  "contract_assertions": [
    {
      "id": "janitor-owns-closeout",
      "description": "Both orchestrator surfaces assign Planar closeout to janitor.",
      "mode": "all",
      "paths": ["skills/src/pl-orchestrator.md", "agents/orchestrator.md"],
      "pattern": "(?s)janitor.*planar plan closeout|planar plan closeout.*janitor",
      "multiline": true
    },
    {
      "id": "no-plan-status-bypass",
      "description": "Archive does not directly force the anchor plan to done.",
      "mode": "none",
      "paths": ["skills/src/pl-orchestrator.md", "agents/orchestrator.md"],
      "pattern": "planar plan update <anchor> --status done"
    },
    {
      "id": "archive-requires-done",
      "description": "The skill states that archive requires a done plan.",
      "mode": "all",
      "paths": ["skills/src/pl-orchestrator.md"],
      "pattern": "requires the anchor plan to already be[[:space:]]+`done`",
      "multiline": true
    }
  ],
  "expected": {}
}
