{
  "schema_version": 1,
  "id": "terminal-ownership-and-blind-review-evidence",
  "skill": "orchestrator",
  "description": "Task terminal ownership and the blind structured-evidence review packet agree across roles.",
  "tags": ["claims", "review", "evidence", "cross-role"],
  "tiers": ["contract"],
  "contract_assertions": [
    {
      "id": "no-coder-task-done",
      "description": "Coder surfaces never use the non-atomic task-done verb.",
      "mode": "none",
      "paths": ["examples/agents/planar-coder.md"],
      "pattern": "planar task done"
    },
    {
      "id": "in-pwd-bypass-exception",
      "description": "Coder and orchestrator agree on the narrow terminal exception.",
      "mode": "all",
      "paths": [
        "examples/agents/planar-coder.md",
        "agents/planar-orchestrator.md"
      ],
      "pattern": "in-pwd.*barrel-bypass|barrel-bypass.*in-pwd",
      "multiline": true
    },
    {
      "id": "blind-structured-packet",
      "description": "Reviewer surfaces exclude coder narrative and consume structured validation evidence.",
      "mode": "all",
      "paths": ["examples/agents/planar-reviewer.md"],
      "pattern": "structured.*evidence|structured validation",
      "multiline": true
    }
  ],
  "expected": {}
}
